{
  "schema_version": "2.0.0",
  "registry_kind": "training_sources",
  "registry_id": "hippocampus-training-sources-v2",
  "created_at": "2026-08-24T00:00:00Z",
  "required_compatibility": "commercial",
  "sources": [
    {
      "source_id": "hf-logic-owa-development-v1",
      "dataset_family": "hf-logic-owa-v1",
      "role": "development",
      "resolved_version": "phase2-v1",
      "generator_id": "hf-logic-owa-v1",
      "generator_spec_sha256": "sha256:227a39432efcf9e37adb9b6f19214abed6365c7aa028848b7e4dd6938ecdbc96",
      "artifact_sha256": "sha256:91729b18f7717fc15f6bd700f4b0585fb83049e0f5a924c588976affa7e506a4",
      "rights": {
        "licence_review_id": "hf-logic-owa-development-rights-v1",
        "provenance_basis": "first_party_procedural",
        "review_status": "pending",
        "commercial_compatibility": "intended_pending_review"
      },
      "admission_state": "declared",
      "blockers": ["project_licence_not_selected", "rights_review_not_final"],
      "dependency_families": {
        "grammar": "hf-logic-owa-development:grammar",
        "world": "hf-logic-owa-development:world",
        "relation_composition": "hf-logic-owa-development:composition",
        "seed_family": "hf-logic-owa-development:seed"
      },
      "training_authorized": false
    },
    {
      "source_id": "hf-logic-owa-training-v1",
      "dataset_family": "hf-logic-owa-v1",
      "role": "training",
      "resolved_version": "phase2-v1",
      "generator_id": "hf-logic-owa-v1",
      "generator_spec_sha256": "sha256:05aa57250d3d364d1b21e9ff4c44664ae28734a4e8ce1417ad97fb167bc9c568",
      "artifact_sha256": "sha256:fba8244ede343e9dd52ac1f769f6f107607a4aae67c51a9867d9615767241d0c",
      "rights": {
        "licence_review_id": "hf-logic-owa-training-rights-v1",
        "provenance_basis": "first_party_procedural",
        "review_status": "pending",
        "commercial_compatibility": "intended_pending_review"
      },
      "admission_state": "declared",
      "blockers": ["project_licence_not_selected", "rights_review_not_final"],
      "dependency_families": {
        "grammar": "hf-logic-owa-training:grammar",
        "world": "hf-logic-owa-training:world",
        "relation_composition": "hf-logic-owa-training:composition",
        "seed_family": "hf-logic-owa-training:seed"
      },
      "training_authorized": false
    },
    {
      "source_id": "hf-process-state-development-v1",
      "dataset_family": "hf-process-state-v1",
      "role": "development",
      "resolved_version": "phase2-v2-process-v1",
      "generator_id": "hf-process-state-v1",
      "generator_spec_sha256": "sha256:26b9f42ea74ae3786191b934857dedda3e76b0e9dee939375ebe498f63e584f2",
      "artifact_sha256": "sha256:9314281a37f68f10a2b1652e0ff4db2c5732682cc46458381fdff66042164ebc",
      "rights": {
        "licence_review_id": "hf-process-state-development-rights-v1",
        "provenance_basis": "first_party_procedural",
        "review_status": "pending",
        "commercial_compatibility": "intended_pending_review"
      },
      "admission_state": "declared",
      "blockers": ["project_licence_not_selected", "rights_review_not_final"],
      "dependency_families": {
        "operation": "hf-process-development:opfam",
        "grammar": "hf-process-development:gramfam",
        "world": "hf-process-development:worldfam",
        "relation_composition": "hf-process-development:compfam",
        "entity_family": "hf-process-development:entityfam",
        "seed_family": "hf-process-development:seedfam"
      },
      "training_authorized": false
    },
    {
      "source_id": "hf-process-state-training-v1",
      "dataset_family": "hf-process-state-v1",
      "role": "training",
      "resolved_version": "phase2-v2-process-v1",
      "generator_id": "hf-process-state-v1",
      "generator_spec_sha256": "sha256:3eb3584e00f34cc47f14c023c9842d245abd4197b1b5673a6b08c362cb62e733",
      "artifact_sha256": "sha256:9124fa3cb284c48af9d20887e615c06fa6986998928920567180b4b847e0326e",
      "rights": {
        "licence_review_id": "hf-process-state-training-rights-v1",
        "provenance_basis": "first_party_procedural",
        "review_status": "pending",
        "commercial_compatibility": "intended_pending_review"
      },
      "admission_state": "declared",
      "blockers": ["project_licence_not_selected", "rights_review_not_final"],
      "dependency_families": {
        "operation": "hf-process-training:opfam",
        "grammar": "hf-process-training:gramfam",
        "world": "hf-process-training:worldfam",
        "relation_composition": "hf-process-training:compfam",
        "entity_family": "hf-process-training:entityfam",
        "seed_family": "hf-process-training:seedfam"
      },
      "training_authorized": false
    }
  ]
}
